{
  "version": "1.0",
  "extracted_at": "2026-08-12T10:20:32.555613Z",
  "source_id": "sd-official",
  "source_type": "official",
  "source_url": "https://advertising.amazon.com/solutions/products/sponsored-display",
  "cache_file": "state/cache/sd-official.txt",
  "content_hash": "3e141a27187a93997d58f62426e0c7b68887228e158eadaf96a5017f53ee5e71",
  "facts": [
    {
      "fact": "Sponsored Display is now part of Amazon's display ads offering",
      "concept": "sponsored-display",
      "quote": "part of Amazon's display ads offering",
      "extracted_at": "2026-08-12T10:20:32.555613Z",
      "confidence": "medium"
    }
  ],
  "extraction_metadata": {
    "extractor_agent": "extractor-sd-official",
    "extraction_duration_ms": 1000
  }
}