{
  "version": "1.0",
  "extracted_at": "2026-08-12T10:20:32.557959Z",
  "source_id": "targeting-official",
  "source_type": "official",
  "source_url": "https://advertising.amazon.com/library/guides/targeting-with-sponsored-products",
  "cache_file": "state/cache/targeting-official.txt",
  "content_hash": "80e0a9025442d6aa0003968eceda3208cc9ea6f785ef2ee7493b77d4859d612a",
  "facts": [
    {
      "fact": "Sample fact from targeting-official",
      "concept": "general",
      "quote": "sample quote",
      "extracted_at": "2026-08-12T10:20:32.557959Z",
      "confidence": "medium"
    }
  ],
  "extraction_metadata": {
    "extractor_agent": "extractor-targeting-official",
    "extraction_duration_ms": 1000
  }
}