{
  "version": "1.0",
  "extracted_at": "2026-08-12T10:20:32.552925Z",
  "source_id": "sb-official",
  "source_type": "official",
  "source_url": "https://advertising.amazon.com/solutions/products/sponsored-brands",
  "cache_file": "state/cache/sb-official.txt",
  "content_hash": "1cfea3bc325d0275632608809f29c52d3087482bdcdadaa5c16246e9497d846a",
  "facts": [
    {
      "fact": "Sponsored Brands is an advertising solution to help customers discover brands",
      "concept": "sponsored-brands",
      "quote": "help customers discover your brand",
      "extracted_at": "2026-08-12T10:20:32.552925Z",
      "confidence": "medium"
    },
    {
      "fact": "Sponsored Brands uses rich display and video creatives",
      "concept": "sponsored-brands",
      "quote": "rich display and video creatives",
      "extracted_at": "2026-08-12T10:20:32.552925Z",
      "confidence": "medium"
    }
  ],
  "extraction_metadata": {
    "extractor_agent": "extractor-sb-official",
    "extraction_duration_ms": 1000
  }
}