{
  "version": "1.0",
  "extracted_at": "2026-08-12T10:20:32.559966Z",
  "source_id": "ppc-community",
  "source_type": "community",
  "source_url": "https://www.junglescout.com/resources/articles/amazon-ppc/",
  "cache_file": "state/cache/ppc-community.txt",
  "content_hash": "c93408e474c375e292e2318653a4e2d6b9f600fe5a8f44dc8ccad6c987cbd59a",
  "facts": [
    {
      "fact": "Sample fact from ppc-community",
      "concept": "general",
      "quote": "sample quote",
      "extracted_at": "2026-08-12T10:20:32.559966Z",
      "confidence": "medium"
    }
  ],
  "extraction_metadata": {
    "extractor_agent": "extractor-ppc-community",
    "extraction_duration_ms": 1000
  }
}